bookId,title,series,author,rating,description,language,genres,pages,publisher,publishDate,coverImg,price,language_2,language_3,language_4,language_5
book_86,The Brothers Karamazov,The Brothers Karamazov #1-4,"Fyodor Dostoyevsky, Fyodor Dostoyevsky, Richard Pevear (Translator), Larissa Volokhonsky (Translator)",4.32,"The Brothers Karamazov is a murder mystery, a courtroom drama, and an exploration of erotic rivalry in a series of triangular love affairs involving the “wicked and sentimental” Fyodor Pavlovich Karamazov and his three sons―the impulsive and sensual Dmitri; the coldly rational Ivan; and the healthy, red-cheeked young novice Alyosha. Through the gripping events of their story, Dostoevsky portrays the whole of Russian life, is social and spiritual striving, in what was both the golden age and a tragic turning point in Russian culture.",english,"['Classics', 'Fiction', 'Russia', 'Literature', 'Russian Literature', 'Philosophy', 'Novels', '19th Century', 'Classic Literature', 'Religion']",796,"Farrar, Straus and Giroux",06/14/02,https://i.gr-assets.com/images/S/compressed.photo.goodreads.com/books/1427728126l/4934.jpg,5.51,,,,
book_87,Angela's Ashes,Frank McCourt #1,Frank McCourt,4.11,"Imbued on every page with Frank McCourt's astounding humor and compassion. This is a glorious book that bears all the marks of a classic.""When I look back on my childhood I wonder how I managed to survive at all. It was, of course, a miserable childhood: the happy childhood is hardly worth your while. Worse than the ordinary miserable childhood is the miserable Irish childhood, and worse yet is the miserable Irish Catholic childhood."" So begins the Pulitzer Prize winning memoir of Frank McCourt, born in Depression-era Brooklyn to recent Irish immigrants and raised in the slums of Limerick, Ireland.",english,"['Nonfiction', 'Memoir', 'Biography', 'Classics', 'Ireland', 'Autobiography', 'Biography Memoir', 'History', 'Irish Literature', 'Historical']",452,Harper Perennial,10/03/05,https://i.gr-assets.com/images/S/compressed.photo.goodreads.com/books/1348317139l/252577.jpg,2.76,,,,
book_88,Vampire Academy,Vampire Academy #1,Richelle Mead (Goodreads Author),4.12,"ONLY A TRUE BEST FRIEND CAN PROTECT YOU FROM YOUR IMMORTAL ENEMIES...Lissa Dragomir is a Moroi princess: a mortal vampire with a rare gift for harnessing the earth's magic. She must be protected at all times from Strigoi; the fiercest vampires - the ones who never die. The powerful blend of human and vampire blood that flows through Rose Hathaway, Lissa's best friend, makes her a dhampir. Rose is dedicated to a dangerous life of protecting Lissa from the Strigoi, who are hell-bent on making Lissa one of them.After two years of freedom, Rose and Lissa are caught and dragged back to St.",english,"['Young Adult', 'Fantasy', 'Vampires', 'Paranormal', 'Romance', 'Urban Fantasy', 'Fiction', 'Supernatural', 'Paranormal Romance', 'Magic']",332,Razorbill,08/16/07,https://i.gr-assets.com/images/S/compressed.photo.goodreads.com/books/1361098973l/345627.jpg,3.33,,,,
book_91,The Golden Compass,His Dark Materials #1,Philip Pullman,3.99,"Lyra is rushing to the cold, far North, where witch clans and armored bears rule. North, where the Gobblers take the children they steal--including her friend Roger. North, where her fearsome uncle Asriel is trying to build a bridge to a parallel world.Can one small girl make a difference in such great and terrible endeavors? This is Lyra: a savage, a schemer, a liar, and as fierce and true a champion as Roger or Asriel could want--but what Lyra doesn't know is that to help one of them will be to betray the other.",english,"['Fantasy', 'Young Adult', 'Fiction', 'Childrens', 'Adventure', 'Science Fiction', 'Science Fiction Fantasy', 'Steampunk', 'Middle Grade', 'Audiobook']",399,Alfred A. Knopf Books for Young Readers,04/16/96,https://i.gr-assets.com/images/S/compressed.photo.goodreads.com/books/1505766203l/119322._SX318_.jpg,1.61,,,,
book_94,Harry Potter and the Prisoner of Azkaban,Harry Potter #3,"J.K. Rowling, Mary GrandPré (Illustrator)",4.57,"Harry Potter's third year at Hogwarts is full of new dangers. A convicted murderer, Sirius Black, has broken out of Azkaban prison, and it seems he's after Harry. Now Hogwarts is being patrolled by the dementors, the Azkaban guards who are hunting Sirius. But Harry can't imagine that Sirius or, for that matter, the evil Lord Voldemort could be more frightening than the dementors themselves, who have the terrible power to fill anyone they come across with aching loneliness and despair. Meanwhile, life continues as usual at Hogwarts. A top-of-the-line broom takes Harry's success at Quidditch, the sport of the Wizarding world, to new heights. A cute fourth-year student catches his eye.",english,"['Fantasy', 'Young Adult', 'Fiction', 'Magic', 'Childrens', 'Adventure', 'Middle Grade', 'Audiobook', 'Classics', 'Science Fiction Fantasy']",435,Scholastic Inc.,05/01/04,https://i.gr-assets.com/images/S/compressed.photo.goodreads.com/books/1499277281l/5.jpg,5.94,,,,
book_96,The Notebook,The Notebook #1,Nicholas Sparks (Goodreads Author),4.11,"Set amid the austere beauty of the North Carolina coast begins the story of Noah Calhoun, a rural Southerner recently returned from the Second World War. Noah is restoring a plantation home to its former glory, and he is haunted by images of the beautiful girl he met fourteen years earlier, a girl he loved like no other. Unable to find her, yet unwilling to forget the summer they spent together, Noah is content to live with only memories...until she unexpectedly returns to his town to see him once again.Like a puzzle within a puzzle, the story of Noah and Allie is just the beginning. As it unfolds, their tale miraculously becomes something different, with much higher stakes.",english,"['Romance', 'Fiction', 'Chick Lit', 'Contemporary', 'Adult', 'Adult Fiction', 'Contemporary Romance', 'Love', 'Drama', 'Classics']",227,Grand Central Publishing,01/05/00,https://i.gr-assets.com/images/S/compressed.photo.goodreads.com/books/1483183484l/33648131._SY475_.jpg,10,,,,
book_97,Winnie-the-Pooh,Winnie-the-Pooh #1,"A.A. Milne, Ernest H. Shepard (Illustrator)",4.34,"The adventures of Christopher Robin and his friends in which Pooh Bear uses a balloon to get honey, Piglet meets a Heffalump, and Eeyore has a birthday.",english,"['Classics', 'Childrens', 'Fiction', 'Fantasy', 'Animals', 'Picture Books', 'Young Adult', 'Audiobook', 'Middle Grade', 'Juvenile']",145,Dutton Juvenile,10/01/01,https://i.gr-assets.com/images/S/compressed.photo.goodreads.com/books/1298440130l/99107.jpg,5.3,,,,
book_99,Interview with the Vampire,The Vampire Chronicles #1,Anne Rice,4,"This is the story of Louis, as told in his own words, of his journey through mortal and immortal life. Louis recounts how he became a vampire at the hands of the radiant and sinister Lestat and how he became indoctrinated, unwillingly, into the vampire way of life. His story ebbs and flows through the streets of New Orleans, defining crucial moments such as his discovery of the exquisite lost young child Claudia, wanting not to hurt but to comfort her with the last breaths of humanity he has inside. Yet, he makes Claudia a vampire, trapping her womanly passion, will, and intelligence inside the body of a small child.",english,"['Horror', 'Fantasy', 'Fiction', 'Vampires', 'Paranormal', 'Supernatural', 'Classics', 'Gothic', 'Urban Fantasy', 'Historical Fiction']",342,Ballantine Books,08/31/04,https://i.gr-assets.com/images/S/compressed.photo.goodreads.com/books/1380631642l/43763.jpg,2.66,,,,
book_104,Harry Potter and the Goblet of Fire,Harry Potter #4,"J.K. Rowling, Mary GrandPré (Illustrator)",4.56,"Harry Potter is midway through his training as a wizard and his coming of age. Harry wants to get away from the pernicious Dursleys and go to the International Quidditch Cup with Hermione, Ron, and the Weasleys. He wants to dream about Cho Chang, his crush (and maybe do more than dream). He wants to find out about the mysterious event that's supposed to take place at Hogwarts this year, an event involving two other rival schools of magic, and a competition that hasn't happened for hundreds of years. He wants to be a normal, fourteen-year-old wizard. But unfortunately for Harry Potter, he's not normal - even by wizarding standards.And in his case, different can be deadly.",english,"['Fantasy', 'Young Adult', 'Fiction', 'Magic', 'Childrens', 'Adventure', 'Audiobook', 'Middle Grade', 'Classics', 'Science Fiction Fantasy']",734,Scholastic,09/28/02,https://i.gr-assets.com/images/S/compressed.photo.goodreads.com/books/1554006152l/6.jpg,10,,,,
book_105,Clockwork Angel,The Infernal Devices #1,"Cassandra Clare (Goodreads Author), Rita Sussekind (Translator)",4.32,"In a time when Shadowhunters are barely winning the fight against the forces of darkness, one battle will change the course of history forever. Welcome to the Infernal Devices trilogy, a stunning and dangerous prequel to the New York Times bestselling Mortal Instruments series.The year is 1878. Tessa Gray descends into London’s dark supernatural underworld in search of her missing brother. She soon discovers that her only allies are the demon-slaying Shadowhunters—including Will and Jem, the mysterious boys she is attracted to. Soon they find themselves up against the Pandemonium Club, a secret organization of vampires, demons, warlocks, and humans.",english,"['Fantasy', 'Young Adult', 'Paranormal', 'Romance', 'Steampunk', 'Historical Fiction', 'Fiction', 'Urban Fantasy', 'Vampires', 'Angels']",481,"Simon & Schuster, Margaret K. McElderry",08/31/10,https://i.gr-assets.com/images/S/compressed.photo.goodreads.com/books/1454962884l/7171637._SY475_.jpg,4.62,,,,
book_106,Harry Potter and the Half-Blood Prince,Harry Potter #6,J.K. Rowling,4.57,"The war against Voldemort is not going well; even Muggle governments are noticing. Ron scans the obituary pages of the Daily Prophet, looking for familiar names. Dumbledore is absent from Hogwarts for long stretches of time, and the Order of the Phoenix has already suffered losses.And yet . . .As in all wars, life goes on. The Weasley twins expand their business. Sixth-year students learn to Apparate - and lose a few eyebrows in the process. Teenagers flirt and fight and fall in love. Classes are never straightforward, through Harry receives some extraordinary help from the mysterious Half-Blood Prince.",english,"['Fantasy', 'Young Adult', 'Fiction', 'Magic', 'Childrens', 'Adventure', 'Audiobook', 'Middle Grade', 'Classics', 'Science Fiction Fantasy']",652,Scholastic Inc.,09/16/06,https://i.gr-assets.com/images/S/compressed.photo.goodreads.com/books/1587697303l/1._SX318_.jpg,10,,,,
book_111,The Name of the Wind,The Kingkiller Chronicle #1,Patrick Rothfuss (Goodreads Author),4.53,"Told in Kvothe's own voice, this is the tale of the magically gifted young man who grows to be the most notorious wizard his world has ever seen. The intimate narrative of his childhood in a troupe of traveling players, his years spent as a near-feral orphan in a crime-ridden city, his daringly brazen yet successful bid to enter a legendary school of magic, and his life as a fugitive after the murder of a king form a gripping coming-of-age story unrivaled in recent literature. A high-action story written with a poet's hand, The Name of the Wind is a masterpiece that will transport readers into the body and mind of a wizard.",english,"['Fantasy', 'Fiction', 'Epic Fantasy', 'High Fantasy', 'Magic', 'Science Fiction Fantasy', 'Adult', 'Adventure', 'Audiobook', 'Epic']",662,Penguin Group DAW,04/28/07,https://i.gr-assets.com/images/S/compressed.photo.goodreads.com/books/1515589515l/186074._SX318_.jpg,9.36,,,,
book_112,The Shining,The Shining #1,Stephen King (Goodreads Author),4.23,"Jack Torrance's new job at the Overlook Hotel is the perfect chance for a fresh start. As the off-season caretaker at the atmospheric old hotel, he'll have plenty of time to spend reconnecting with his family and working on his writing. But as the harsh winter weather sets in, the idyllic location feels ever more remote...and more sinister. And the only one to notice the strange and terrible forces gathering around the Overlook is Danny Torrance, a uniquely gifted five-year-old.",english,"['Horror', 'Fiction', 'Thriller', 'Classics', 'Fantasy', 'Mystery', 'Paranormal', 'Suspense', 'Novels', 'Adult']",659,New English Library (Hodder & Stoughton),07/01/80,https://i.gr-assets.com/images/S/compressed.photo.goodreads.com/books/1353277730l/11588.jpg,7.59,,,,
book_113,The Adventures of Tom Sawyer,Adventures of Tom and Huck #1,"Mark Twain, Guy Cardwell (Annotations), John Seelye (Introduction)",3.91,"The Adventures of Tom Sawyer revolves around the youthful adventures of the novel's schoolboy protagonist, Thomas Sawyer, whose reputation precedes him for causing mischief and strife. Tom lives with his Aunt Polly, half-brother Sid, and cousin Mary in the quaint town of St. Petersburg, just off the shore of the Mississippi River. St. Petersburg is described as a typical small-town atmosphere where the Christian faith is predominant, the social network is close-knit, and familiarity resides.",english,"['Classics', 'Fiction', 'Adventure', 'Young Adult', 'Historical Fiction', 'Literature', 'Childrens', 'School', 'Novels', 'American']",244,Penguin Classics,02/28/06,https://i.gr-assets.com/images/S/compressed.photo.goodreads.com/books/1404811979l/24583.jpg,3.36,,,,
book_114,Eragon,The Inheritance Cycle #1,Christopher Paolini (Goodreads Author),3.9,"An alternate cover edition for ISBN 9780375826696 can be found here.One boy...One dragon...A world of adventure. When Eragon finds a polished blue stone in the forest, he thinks it is the lucky discovery of a poor farm boy; perhaps it will buy his family meat for the winter. But when the stone brings a dragon hatchling, Eragon soon realizes he has stumbled upon a legacy nearly as old as the Empire itself. Overnight his simple life is shattered, and he is thrust into a perilous new world of destiny, magic, and power.",english,"['Fantasy', 'Young Adult', 'Fiction', 'Dragons', 'Adventure', 'Magic', 'High Fantasy', 'Science Fiction Fantasy', 'Young Adult Fantasy', 'Childrens']",503,Alfred A. Knopf,04/28/05,https://i.gr-assets.com/images/S/compressed.photo.goodreads.com/books/1366212852l/113436.jpg,2.86,,,,
book_115,Charlie and the Chocolate Factory,Charlie Bucket #1,"Roald Dahl, Quentin Blake (Illustrations)",4.14,"Charlie Bucket's wonderful adventure begins when he finds one of Mr. Willy Wonka's precious Golden Tickets and wins a whole day inside the mysterious chocolate factory. Little does he know the surprises that are in store for him!
(back cover).",english,"['Childrens', 'Fantasy', 'Fiction', 'Classics', 'Young Adult', 'Middle Grade', 'Humor', 'Adventure', 'Juvenile', 'Novels']",176,Puffin Books,06/02/05,https://i.gr-assets.com/images/S/compressed.photo.goodreads.com/books/1309211401l/6310.jpg,1.13,,,,
book_117,On the Road,Duluoz Legend,Jack Kerouac,3.62,"A quintessential novel of America & the Beat Generation On the Road chronicles Jack Kerouac's years traveling the N. American continent with his friend Neal Cassady, ""a sideburned hero of the snowy West."" As ""Sal Paradise"" & ""Dean Moriarty,"" the two roam the country in a quest for self-knowledge & experience. Kerouac's love of America, compassion for humanity & sense of language as jazz combine to make On the Road an inspirational work of lasting importance. This classic novel of freedom & longing defined what it meant to be ""Beat"" & has inspired every generation since its initial publication.",english,"['Classics', 'Fiction', 'Travel', 'Literature', 'Novels', 'American', 'Adventure', '20th Century', 'Unfinished', 'Modern Classics']",307,Penguin Books,01/01/76,https://i.gr-assets.com/images/S/compressed.photo.goodreads.com/books/1413588576l/70401.jpg,1.91,,,,
book_120,The Shadow of the Wind,El cementerio de los libros olvidados #1,"Carlos Ruiz Zafón, Lucia Graves (Translator)",4.27,"Barcelona, 1945: A city slowly heals from its war wounds, and Daniel, an antiquarian book dealer's son who mourns the loss of his mother, finds solace in a mysterious book entitled The Shadow of the Wind, by one Julian Carax. But when he sets out to find the author's other works, he makes a shocking discovery: someone has been systematically destroying every copy of every book Carax has written. In fact, Daniel may have the last of Carax's books in existence. Soon Daniel's seemingly innocent quest opens a door into one of Barcelona's darkest secrets--an epic story of murder, madness, and doomed love.--back cover.",english,"['Fiction', 'Historical Fiction', 'Mystery', 'Fantasy', 'Books About Books', 'Historical', 'Spain', 'Spanish Literature', 'Gothic', 'Magical Realism']",487,Penguin Books,10/28/05,https://i.gr-assets.com/images/S/compressed.photo.goodreads.com/books/1597921581l/1232.jpg,10,,,,
book_127,Harry Potter and the Chamber of Secrets,Harry Potter #2,"J.K. Rowling, Mary GrandPré (Illustrator)",4.43,"Ever since Harry Potter had come home for the summer, the Dursleys had been so mean and hideous that all Harry wanted was to get back to the Hogwarts School for Witchcraft and Wizardry. But just as he’s packing his bags, Harry receives a warning from a strange impish creature who says that if Harry returns to Hogwarts, disaster will strike.And strike it does. For in Harry’s second year at Hogwarts, fresh torments and horrors arise, including an outrageously stuck-up new professor and a spirit who haunts the girls’ bathroom. But then the real trouble begins – someone is turning Hogwarts students to stone.",english,"['Fantasy', 'Young Adult', 'Fiction', 'Magic', 'Childrens', 'Middle Grade', 'Adventure', 'Audiobook', 'Classics', 'Science Fiction Fantasy']",341,Arthur A. Levine Books / Scholastic Inc.,06/02/99,https://i.gr-assets.com/images/S/compressed.photo.goodreads.com/books/1474169725l/15881._SY475_.jpg,4.17,,,,
book_128,The Godfather,The Godfather #1,"Mario Puzo, Robert Thompson (Introduction), Peter Bart (Afterword)",4.36,"The Godfather—the epic tale of crime and betrayal that became a global phenomenon.Almost fifty years ago, a classic was born. A searing portrayal of the Mafia underworld, The Godfather introduced readers to the first family of American crime fiction, the Corleones, and their powerful legacy of tradition, blood, and honor. The seduction of power, the pitfalls of greed, and the allegiance to family—these are the themes that have resonated with millions of readers around the world and made The Godfather the definitive novel of the violent subculture that, steeped in intrigue and controversy, remains indelibly etched in our collective consciousness.~penguin.com.",english,"['Fiction', 'Classics', 'Crime', 'Thriller', 'Historical Fiction', 'Mystery', 'Drama', 'Novels', 'Literature', 'American']",448,NAL,03/01/02,https://i.gr-assets.com/images/S/compressed.photo.goodreads.com/books/1394988109l/22034._SY475_.jpg,10,,,,
book_132,The Five People You Meet in Heaven,The Five People You Meet in Heaven #1,Mitch Albom (Goodreads Author),3.94,"From the author of the phenomenal #1 New York Times bestseller Tuesdays with Morrie, a novel that explores the unexpected connections of our lives, and the idea that heaven is more than a place; it's an answer. Eddie is a wounded war veteran, an old man who has lived, in his mind, an uninspired life. His job is fixing rides at a seaside amusement park. On his 83rd birthday, a tragic accident kills him as he tries to save a little girl from a falling cart. He awakes in the afterlife, where he learns that heaven is not a destination. It's a place where your life is explained to you by five people, some of whom you knew, others who may have been strangers.",english,"['Fiction', 'Inspirational', 'Contemporary', 'Fantasy', 'Adult', 'Spirituality', 'Classics', 'Adult Fiction', 'Philosophy', 'Novels']",196,Hyperion,09/23/03,https://i.gr-assets.com/images/S/compressed.photo.goodreads.com/books/1388200541l/3431.jpg,3.57,,,,
